{
  "created_at": "2026-09-27T07:29:00Z",
  "frozen_at": "2026-09-27T07:29:00Z",
  "records": [
    {
      "flight_id": "flight-146",
      "group_id": "grp-2c3e63318ab6eae4e8d6",
      "reason": "Source remains quarantined; batch validation does not authorize training or evaluation.",
      "sha256": "04c6472655de85fc2e7955fb2214ad29ed00eef08e83f1491dd7c67f7186d869",
      "split": "excluded"
    },
    {
      "flight_id": "flight-147",
      "group_id": "grp-526321b4fa6c17f50963",
      "reason": "Source remains quarantined; batch validation does not authorize training or evaluation.",
      "sha256": "a7dfefb90004bad5cb089e8be8bd7cc40d84ec05d05e785f5a68d5ef2e20049a",
      "split": "excluded"
    },
    {
      "flight_id": "flight-148",
      "group_id": "grp-9023a76f4086ee8613f4",
      "reason": "Source remains quarantined; batch validation does not authorize training or evaluation.",
      "sha256": "dbb81a01c0d576148bbd232b512934d13c8700c9fddb65868ca6047ceb02beb2",
      "split": "excluded"
    },
    {
      "flight_id": "flight-149",
      "group_id": "grp-a21deb855810e6a35585",
      "reason": "Source remains quarantined; batch validation does not authorize training or evaluation.",
      "sha256": "492d6cad27c16b29e15c0454f7780a10dc09362f1544bab24b9d693c9e35a568",
      "split": "excluded"
    },
    {
      "flight_id": "flight-150",
      "group_id": "grp-94fb736d71179fd586fc",
      "reason": "Source remains quarantined; batch validation does not authorize training or evaluation.",
      "sha256": "76b5c109c79def3ba2b3bed4a28a2174ab558084eb5b2aff10a2cf4b59ac2c06",
      "split": "excluded"
    }
  ],
  "schema_version": "1.0.0",
  "source_id": "uav-sead",
  "source_version": "774a336a1d1d06b248927a35c2ea1f6869e9e1a4",
  "status": "frozen",
  "training_authorized": false
}
