{
  "created_at": "2026-09-27T11:33:00Z",
  "frozen_at": "2026-09-27T11:33:00Z",
  "records": [
    {
      "flight_id": "flight-166",
      "group_id": "grp-665a7c3279b55d139e98",
      "reason": "Source remains quarantined; batch validation does not authorize training or evaluation.",
      "sha256": "a7240ef7da6a4c210d3a128f5f195bb451f66bb82e5a68b40c27f2a71d81ae65",
      "split": "excluded"
    },
    {
      "flight_id": "flight-167",
      "group_id": "grp-6fa87fc1dba9be707e00",
      "reason": "Source remains quarantined; batch validation does not authorize training or evaluation.",
      "sha256": "acb5da341a0fcd929ff0b0db6e544797681cf138138940ffd4863d56f29dde6b",
      "split": "excluded"
    },
    {
      "flight_id": "flight-168",
      "group_id": "grp-6fa87fc1dba9be707e00",
      "reason": "Source remains quarantined; batch validation does not authorize training or evaluation.",
      "sha256": "c5d24bf161706b146e9fcde198fc2556cc6c06d91f6f8f70bafcbf4cb61fc703",
      "split": "excluded"
    },
    {
      "flight_id": "flight-169",
      "group_id": "grp-9e43286f99a5c3e7f1de",
      "reason": "Source remains quarantined; batch validation does not authorize training or evaluation.",
      "sha256": "2a0bc720b48d90672345641376a9403956d96b349a355015f344c435b0a61251",
      "split": "excluded"
    },
    {
      "flight_id": "flight-170",
      "group_id": "grp-27bcd5cf2c16dc2734c5",
      "reason": "Source remains quarantined; batch validation does not authorize training or evaluation.",
      "sha256": "bdf5c0711d5f6b9794421e3f959546361e444b51ebee03b354a7bee5678f0cd4",
      "split": "excluded"
    }
  ],
  "schema_version": "1.0.0",
  "source_id": "uav-sead",
  "source_version": "774a336a1d1d06b248927a35c2ea1f6869e9e1a4",
  "status": "frozen",
  "training_authorized": false
}
