{
  "created_at": "2026-09-27T04:11:00Z",
  "frozen_at": "2026-09-27T04:11:00Z",
  "records": [
    {
      "flight_id": "flight-056",
      "group_id": "grp-bd594f0d3903db4bfaec",
      "reason": "Source remains quarantined; batch validation does not authorize training or evaluation.",
      "sha256": "7f610c3b40db578d25138094d82d6ef57c0c71e65d214af0d6cb492cf763e1ab",
      "split": "excluded"
    },
    {
      "flight_id": "flight-057",
      "group_id": "grp-028f8911bdf859f15b81",
      "reason": "Source remains quarantined; batch validation does not authorize training or evaluation.",
      "sha256": "a1ab51c12cd48741b077892759840a7358e7d3f16c5c8b9c6a5a48ee6fa7a6b7",
      "split": "excluded"
    },
    {
      "flight_id": "flight-058",
      "group_id": "grp-9e9c51198620a35f5512",
      "reason": "Source remains quarantined; batch validation does not authorize training or evaluation.",
      "sha256": "fa6e5527030b83a95be74f3b504c60910cee272d90035d9f572c10d936966245",
      "split": "excluded"
    },
    {
      "flight_id": "flight-059",
      "group_id": "grp-154af69038feec26165a",
      "reason": "Source remains quarantined; batch validation does not authorize training or evaluation.",
      "sha256": "07b9c4a364cf4a2522db7de400e8a161d9e112b3c35a50b201a45436906509f7",
      "split": "excluded"
    },
    {
      "flight_id": "flight-060",
      "group_id": "grp-0eb4c2be2a6defa38fce",
      "reason": "Source remains quarantined; batch validation does not authorize training or evaluation.",
      "sha256": "a339d0bb65b79ca05a4e997b5864608788851822c536d79679a6e8b64118f385",
      "split": "excluded"
    }
  ],
  "schema_version": "1.0.0",
  "source_id": "uav-sead",
  "source_version": "774a336a1d1d06b248927a35c2ea1f6869e9e1a4",
  "status": "frozen",
  "training_authorized": false
}
