{
  "created_at": "2026-09-27T07:28:00Z",
  "frozen_at": "2026-09-27T07:28:00Z",
  "records": [
    {
      "flight_id": "flight-141",
      "group_id": "grp-76ed8c5eb9c43b3678bf",
      "reason": "Source remains quarantined; batch validation does not authorize training or evaluation.",
      "sha256": "888ffe79a73b559799b70b808e4fe92fb532f817bfb7f0dfa0154add7a6a5652",
      "split": "excluded"
    },
    {
      "flight_id": "flight-142",
      "group_id": "grp-50f160f84ce55762ae20",
      "reason": "Source remains quarantined; batch validation does not authorize training or evaluation.",
      "sha256": "ee4babb8166f4c9b0c3bb1e433cea101e8dd886afe31983828d532236dcaab98",
      "split": "excluded"
    },
    {
      "flight_id": "flight-143",
      "group_id": "grp-7f3822feb3b14f53be70",
      "reason": "Source remains quarantined; batch validation does not authorize training or evaluation.",
      "sha256": "89b5390ec39ad603fba80d8f0889933c2fabfff89d93341b09bc62b17e595eb1",
      "split": "excluded"
    },
    {
      "flight_id": "flight-144",
      "group_id": "grp-74aa61b08f14f4abc4e8",
      "reason": "Source remains quarantined; batch validation does not authorize training or evaluation.",
      "sha256": "4755e4952e5abfd62b3e1cb88b32a2d0c48957f3b91aa3a69acc880b67157629",
      "split": "excluded"
    },
    {
      "flight_id": "flight-145",
      "group_id": "grp-b700493847ee53a8ac46",
      "reason": "Source remains quarantined; batch validation does not authorize training or evaluation.",
      "sha256": "4b52a55d8a6b3300d3d0a271f725b2828cb165fbf8a79ca5130ad0dc930e9917",
      "split": "excluded"
    }
  ],
  "schema_version": "1.0.0",
  "source_id": "uav-sead",
  "source_version": "774a336a1d1d06b248927a35c2ea1f6869e9e1a4",
  "status": "frozen",
  "training_authorized": false
}
