{
  "created_at": "2026-09-27T06:20:00Z",
  "frozen_at": "2026-09-27T06:20:00Z",
  "records": [
    {
      "flight_id": "flight-101",
      "group_id": "grp-7404cd4c31494103ba6c",
      "reason": "Source remains quarantined; batch validation does not authorize training or evaluation.",
      "sha256": "26e63c2764d5f64f0b9d3fbb44938ed20ee9498754b951fbb9a3b3dbd0e38c42",
      "split": "excluded"
    },
    {
      "flight_id": "flight-102",
      "group_id": "grp-c6d8d2e102efe7ee5404",
      "reason": "Source remains quarantined; batch validation does not authorize training or evaluation.",
      "sha256": "3e63f116cdcdd0af1373f10896ffe89faafaac51ef0f218407f2e2d48403197e",
      "split": "excluded"
    },
    {
      "flight_id": "flight-103",
      "group_id": "grp-335e596e716d2a2a0cb7",
      "reason": "Source remains quarantined; batch validation does not authorize training or evaluation.",
      "sha256": "35cfbaa691f9b352b4a1c13203663e6783eb3d3a8996d507ea817119d5a1d8bb",
      "split": "excluded"
    },
    {
      "flight_id": "flight-104",
      "group_id": "grp-9a811658dd57f2dbf530",
      "reason": "Source remains quarantined; batch validation does not authorize training or evaluation.",
      "sha256": "14fadd7fc9a152fef8cc9eb54fad74186e2b049a39efba495534e0222622f950",
      "split": "excluded"
    },
    {
      "flight_id": "flight-105",
      "group_id": "grp-b8dc0bdd95f2c9ab0809",
      "reason": "Source remains quarantined; batch validation does not authorize training or evaluation.",
      "sha256": "02d842a57f3d3e2409629b97544ff0fa7fd8fefb2cf1badf404302d870d2c6a2",
      "split": "excluded"
    }
  ],
  "schema_version": "1.0.0",
  "source_id": "uav-sead",
  "source_version": "774a336a1d1d06b248927a35c2ea1f6869e9e1a4",
  "status": "frozen",
  "training_authorized": false
}
